Post Title,Link,Date,Content
"Samsung S22 Ultra 天藍色官網限定預購，加送你達 HK$4,494 禮遇",https://chinese.engadget.com//samsung-galaxy-s22u-skyblue-preorder-080014754.html,2022-06-30,"['Engadget 編輯團隊致力為你蒐羅優質產品及優惠價格，文章內部份連結商戶與 Engadget 有合作關係，定價及供應量有機會更改，一切以商戶最新資料為凖。', 'Galaxy S22 Ultra 天藍色版本只有 12GB RAM + 512GB 儲存空間版本可選，售價為 HK$10,798，購買時會贈送價值 HK$698 的 ITFIT 空氣循環扇、價值 HK$1,298 的兩年 Samsung Care+ 保養服務以及價值 HK$1,698 的 Samsung Buds Pro 降噪耳機，另外還有 HK$800 的 Galaxy Credit 讓你一併購買所需配件。', 'Galaxy S22 Ultra 採用了 6.8 吋的 Dynamic AMOLED 2X 面板，有著 120Hz 高自適應刷新率，可為用家提供流暢、低延遲的視覺體驗，另外其最高亮度可達 1,750 尼特，即使烈日當空的情況下依舊可以清晰看清內容。', '作為首款內置 S Pen 的 Galaxy S 系列手機，其大尺寸螢幕可以為書寫功能提供更好體驗，配合 S Pen 的隔空操作功能可以遙控拍照、操作手機等，即可使日常生活更為便利。']"
Samsung 父親節優惠第二波，75 折入手 Z Flip 3,https://chinese.engadget.com//samsung-fathers-day-deal-week-1-060051437.html,2022-06-10,"['Engadget 編輯團隊致力為你蒐羅優質產品及優惠價格，文章內部份連結商戶與 Engadget 有合作關係，定價及供應量有機會更改，一切以商戶最新資料為凖。', '今年 6 月 19 日便是父親節，為了答謝他在這一年辛勞工作、照顧家人，Samsung 特地推出了父親節專屬優惠。由今天起直至 19 日連續三週，官網上都會有不同產品折扣，讓各位子女準備好合適的禮物，好在當中孝敬父親。', '現在到 Samsung 網店購買指定型號的 Samsung 智能手機、平板電腦或個人電腦，即可免費獲贈 ITFIT 2-in-1 頸部恆溫按摩枕一個，為他們消除日常辛勞。', '另外，與 Galaxy S22／Tab S8／Z Fold 3／Z Flip 3／Book 2 Pro／Pro 360 系列一同購買時，Galaxy Watch 4 及 Galaxy Buds 2 都會有不同的現金折扣，這兩款配件都能有效地配搭迎合爸爸日常生活工作需要。', '由 6 月 11 起至 6 月 19 日，Samsung 將以七五折限量發售 10 台 Galaxy Z Flip 3，由原價 HK$8,298 減至  HK$6,223 即可入手。並會附帶 4 個月 YouTube Premium 試用優惠，另外還有 HK$800 的 Galaxy Credit 讓你一併購買所需配件。', '作為首款內置 S Pen 的 Galaxy S 系列手機，其大尺寸螢幕可以為書寫功能提供更好體驗，配合 S Pen 的隔空操作功能可以遙控拍照、操作手機等，即可使日常生活更為便利。', '由 6 月 11 起至 6 月 19 日，Samsung 限量減價 HK$800 發售 10 台 Galaxy S22 Ultra，512GB／12GB 版本由原價 HK$10,798 減至 HK$9,998 即可入手。更會贈送價值 HK$938 的 ITFIT 2 合 1 頸部恆溫按摩枕，亦會附帶 4 個月 YouTube Premium 試用優惠，另外還有 HK$800 的 Galaxy Credit 讓你一併購買所需配件。', '現在購買各款 Galaxy Watch 4 即送你 ITFIT 無線眼部按摩機以及 HK$300 的百佳超市電子禮券，而且如果跟以上提到的系列產品一同購買，更可再即享 HK$1,100 折扣優惠，十分划算。', '現在購買各款 Galaxy Buds 2 即送你 HK$400 的 Google Play 禮品卡，以供你購買或訂閱所需應用程式，而且如果跟以上提到的系列產品一同購買，更可再即享 HK$700 折扣優惠。', '']"
Samsung 為 Galaxy S22 加回效能限制功能的開關,https://chinese.engadget.com//samsung-galaxy-s-22-performance-throttling-update-available-050059845.html,2022-03-11,"['目前 Samsung 未有透露在其他地方推出同類更新的安排，也未知同受如此效限的舊款 Galaxy 裝置會否也會有同一更新。不過既然是面臨多方壓力之下的措拖，相信大家也不需要多等太久。', '這個會限制手機效能的 GOS 服務，最為人垢病的部分並不光是 Samsung 自顧自的為使用者下這個決定，更重要的是連不是遊戲的其他 app 也會被限制到，是對使用者的日常使用都帶來影響。']"
Samsung Galaxy S22 Ultra 評測：魚與熊掌、二者兼得,https://chinese.engadget.com//samsung-galaxy-s22-ultra-review-100035411.html,2022-03-02,"['然而 S22 Ultra 是否真的是大家眼看到的舊酒新瓶？還是僅僅用上同一個模樣，但給了更好的內涵呢？小編就希望透過這回的評測，給大家分享一下想法。', '就如小編在 Galaxy S22 Ultra 動手玩所說，這款手機幾乎就是 Galaxy Note 20 Ultra 的借屍還魂。因為完全不像 Galaxy S 系列的圓角直板手機設計，反而就是完全用上 Galaxy Note 的四邊窄邊框、直角直板的俐落；在把 Galaxy S22 系列三機並肩放在一起時更是明顯，就是「這孩子是外來的吧」的這種感覺。無論如何，Samsung 都已經把這樣的孩子手機冠上 S 的名字，那就是一家人囉。', 'Galaxy S22 Ultra 是一台 6.8 吋的巨屏手機，加上 229g 的重量，拿在手上是有一定存在感。然而想必慣用 Galaxy Note 的一眾粉絲，都不會把這點份量當作障礙，同時也是樂於雙手操作手機了。', '說是 S22 Ultra 跟 Note 20 Ultra 有 87% 相似，但細節上卻是有相當的不一樣。在三圍的數字上，S22 Ultra 矮了 1mm、寬了 0.7mm、厚了 0.8mm、重了 21g，不過考慮到電池是升級到 5,000mAh 之大，所以也是個很合理的調整。再看就是 S22 Ultra 的中框是很簡單的直線一條，而非過去還希望能裝窈窕的修飾曲線，這邊也直接影響到機背玻璃是簡單的曲面玻璃，少了些花巧，相信也會減低製作的難度和成本。', '另一個不同之處，就是 S22 Ultra 的 SIM 卡槽也跟 S21 Ultra 一樣位於機底，然而退卡針孔卻要與同在機底的收音麥克風比鄰而居，真的就在旁邊。新手用家一個走神，很大機會就會用力把麥克風戳爆，然後就要把手機送修。雖然 S22 Ultra 在全新包裝的時候，是有附上提示貼紙，不過是否每個人都如此注意到？何況意外，就是意料之外的事情啊。', 'Samsung 還是有在 S22 Ultra 上給些新鮮感，這就是相機的部分。近來智慧型手機相機都會有一個大大的台階來把多顆凸起的鏡頭整理起來，但 S22 Ultra 卻就這樣讓鏡頭直接從機背「長出來」，雖然能減少因為巨大模組而帶來的累贅感，但卻會帶來灰塵會堆積在各顆鏡頭圈的問題。是說，小編的 iPhone 13 Pro 也是有同樣的積塵問題，但 S22 Ultra 的優勝處是鏡頭之間的空間比較大，抹布比較容易擠進去做清潔。', '說到 S22 Ultra 的亮點，自然就是其經典巨屏和 S Pen 的組合：因為巨屏而生的 S Pen 以及為了 S Pen 而生的巨屏，是唇齒相依的共生關係。', '先說螢幕，S22 Ultra 用上一片 6.8 吋 QHD+ 解析度的 Dynamic AMOLED 2X Display 面板，同樣會有著最高 120Hz 自適應刷新率，似乎與前代沒有太多差異？不，這回 Samsung 把最低刷新率降至僅有 1Hz，能讓靜止畫面時的耗電量壓到最低。', '可惜的是小編透過 Android 系統內建的螢幕更新率監測功能，看到的最低數字只是 24Hz 而已。但這也不完全代表 S22 Ultra 的刷新率沒有往下探，因為去年 S21 Ultra 也有聲稱最低刷新率為 10Hz，而相關系統功能就停在 60Hz，所以在這樣的對比之下，可見 S22 Ultra 的最低刷新率的確是有比較低。只是我們大家都比較希望能看到有一個明明白白的數字，一洗諸多的陰謀論或疑惑了。', 'S22 Ultra 這片螢幕還有其他的新能力需要介紹，先是 Samsung 會在遊戲模式下，讓螢幕觸控採樣率提升到電競手機級的 240Hz，用於對應瞬間改變操作指令的緊張戰鬥。還有一個大家是更容易直接看到的改變，就是這片螢幕可以特別亮、特別暗。', '亮的部分，S22 Ultra 的螢幕最高亮度可達 1,750 尼特之高，再配合 Vision Booster 的畫面調適技術，讓螢幕畫面在大太陽底下也能清晰可見。至於暗，因為 Android 12 加入了「額外調暗」的功能，受惠於此的 S22 Ultra 就可以再進一步調暗螢幕，即使是偷偷在被窩裡玩遊戲也不會那麼刺眼了，不過好孩子勿試，乖乖睡覺比較好。無調是更亮、更暗，有更具彈性的顯示能力，都讓 S22 Ultra 能在不同環境下都依然能用，在手機不離手的今天提供更好的觀賞體驗。', '', '不過大家都要注意的是，Samsung 以環保之名，不再為支援超音波指紋辨識技術的 S22 Ultra 附上專用的螢幕保護貼，出廠時就只有一張必須要撕走保護膠貼，而且還僅覆蓋到螢幕中間，兩側曲面是沒受保護的。為手機螢幕添加保護貼的動作相信已經是不少使用者購機之後的第一件事，保護殻反倒不是最主要的。在考慮到超音波指紋辨識器會被一般螢幕保護貼影響表現，使用者幾乎都要買官方的才有保障，所以大家買新手機時也要多準備一點錢啦。', '再下來的就是 S Pen，在 S22 Ultra 裡屬於最重要的賣點，沒有之一的重中之重。因為回想 Samsung 在 Galaxy S21 Ultra 裡也是引入了 S Pen 支援，但因為要另購配件，基本是喪失了 S Pen 直接內建到裝置而帶來的獨特性，可見這並非獲消費者支持的代替方案。因此 S22 Ultra 會乾脆複製 Galaxy Note 也並不叫人意外，而 S Pen 的一系列功能也如數回歸，相信大家也不會再有意見了吧。', '當然 Samsung 並沒有過份得把 Note 20 Ultra 換個名字就拿出來，S22 Ultra 的 S Pen 還是有改進的，他們這回強調 S Pen 的書寫體驗會更擬真，因為筆觸的延時會減少至僅 2.8ms，即代表筆畫會更即時顯示在畫面上的意思。不過如此細微的感覺也真的很難說出差異來，反正 S Pen 愈來愈強就對了。', '在跟 Note 20 Ultra 的 S Pen 直接對比之下，可見 S22 Ultra 的 S Pen 原來也有在細節上提升質感。就是新的 S Pen 有在表面添加霧面塗層，既能提升手感，也是增加了磨擦力防滑，這樣在書寫時就有更好的穩定性。', 'Galaxy S 的系列賣點就是相機，也並沒有因為 S22 Ultra 多了支筆而改變。規格上，S22 Ultra 跟 S21 Ultra 同樣為四攝組合，有 108MP 廣角相機、12MP 超廣角相機，以及兩顆 10MP 的 3 倍和 10 倍遠攝相機。更確實的說，後面的 CMOS 其實也跟前代一樣。這是個沒誠意的升級嗎？不太準確，因為要是你從 Note 20 Ultra 升級過來，這是個根本的升級（Note 20 Ultra 的主相機僅有 50MP）；如果是由 S21 Ultra 換過來的話，也會因為拍攝效能的提升而有受惠。', 'Samsung 為 S22 Ultra 創作了新的單字「Nightography」黑夜亮攝，很明顯的就是他們要強調夜拍的能力。就如小編在動手玩時的測試，S22 Ultra 能夠在昏暗的環境裡拍出很不錯的成像，但這時候就總有人跑出來要求比較的。那小編也只好跟家中毛孩相借他們的貓屋和可憐的玩偶，營造一個小黑箱來拍攝。由於硬體上 S21 Ultra 和 S22 Ultra 都是用上同樣的 ISOCELL HM3 108MP CMOS，會以畫素九合一 Nonacell 技術來把畫素合併為 2.4μm 的大尺寸來拍攝，所以兩機其實都能拍攝近似的清晰畫面，至於勝負就在細節。', 'S22 Ultra 的成像是有更完整的曝光，玩偶本體有「打亮」的部分更多，而且進入 EXIF 來看，ISO 感光值更低（2000 vs 3000），因此成像可以有更好的細節、更低雜訊影響，而且色調也更準確。會有這般的提升，Samsung 是歸功於新世代處理器在 NPU 的提升，利用 AI 技術來強化拍攝效能。', '', '同樣有提升的，還有 1 億畫素拍攝模式下的清晰度。過去 Samsung 手機在使用自家的 108MP CMOS 時，效果總會被其他品牌比下去，但這回他們就在 108MP 的拍攝模式中再加入「細節增強」的功能。在手動開啟之後，所拍攝的超高畫素相片能在放大後有更清晰的細節，更適合給有要求的人士「吹毛求疵」。不過這個功能也會有代價，就是會讓檔案體積再增加約 20%（圖例為 10.9MB vs 12.8MB），畢竟也儲存了更多的內容嘛。', '在選擇分享畫面之後，Duo 還會問說要要分享哪一個畫面，選項包括 YouTube、Google Maps、媒體瀏覽器（也就是圖冊）和 Samsung Note，當然不能少了手機螢幕本人了。先試的是手機螢幕畫面，內容可是完全無修正地分享給對方，有點像 Chromecast 投放鏡像畫面到電視的概念，因為就連進來的手機通知都被看到，有點尷尬的呢。至於其他的幾個 app，想說是原生的分享過去嗎？結果這僅是個快捷鍵，背後還是一個螢幕分享的能力。', '然而這樣的螢幕延伸是有什麼的用途呢？除了為螢幕本來已經有夠大的 Tab S8 Ultra 再多爭取幾咪咪的空間來書寫，工具列能放大一點比較便利點選之外，還真的想不太到實際作用。嗯，是展示 Samsung 也能做到跨裝置連動的效果吧。當然，這也預示了其他第三方 app 也將能善用這樣的連動能力，只是就目前僅有 Samsung 的長久搭檔 Clip Studio Paint 這一繪圖工具有支援，或許畫師們比較清楚把調色盤分到另一個裝置上的好處。', '另外還有一些 Galaxy S22 Ultra 跟 Galaxy Tab S8 Ultra 連動使用的功能，小編就不花這裡的篇幅了，有興趣的朋友可以期待後續的文章介紹。', '今年 Samsung 大幅簡化了 S22 系列的規格，各型號的 RAM 都是看齊的，僅有不同儲存空間的多寡差異，沒有再分高、低配版本。S22 Ultra 就統一為 12GB RAM，跑分的成績也會比較具代表性，而小編所借得的是 512GB 儲存空間的版本。', '在進行效能測試之後，針對綜合圖像處理的 3D Mark 中，S22 Ultra 的成績是最亮眼的，有著接近翻倍的增長；分有 CPU 和 GPU 測試的 Geekbench 5 中，增長就沒有如此明顯，僅十數個百分比；PC Mark 3.0 更是出現了倒退的成績，說實在是有點奇怪。然而小編保持一貫的立場，就是跑分成績僅作參考，差個一千幾百分是不會對日常使用帶來影響。', '3D Mark', 'Wild Life: 9,734 / Wild Life Extreme: 2,546', 'Geekbench 5', 'Single-Core: 1,230 / Multi-Core: 3,531 / Compute: 5,914', 'PCMark 3.0: 11,575', '真正對使用體驗帶來直接影響的規格，就是電池了。S22 Ultra 續用支援 45W 快充的 5,000mAh 電池，在 S21 Ultra 的經驗就已經能輕鬆用個一天，來到螢幕、處理器的功耗都有改進的新機器，自然也是沒有問題吧。', '就著 Galaxy S22 Ultra 本身來說，的確是可以視為相機升級版的 Galaxy Note 20 Ultra，但這也未嘗不可。小編的確能再一次體驗到內建 S Pen 的便利，同時還能一嚐一億畫素相機的超高解析度，就等於同時在使用 Note 20 Ultra + S21 Ultra 一樣的感覺，把 Samsung 手機最強的功能通通都在一台手機上使用到。Samsung 老用戶終於不再需要煩惱在兩款差異愈來愈少的旗艦之間選擇，一台就能滿足，這也是標題所說魚與熊掌、二者兼得的感覺。不過日後大家要面對的，可能就變成螢幕要不要折的問題吧。', '不過 Samsung 在手機之外，近年也在強調他們生態圈的結合：資料的同步、跨裝置的連動。出發點無疑是用以跟進 Apple 家的發展，可惜的是後者在軟體系統上面擁有更全面的掌控，而 Samsung 還要受制於 Android 和 Windows 的兼容度，使得一些功能只可以將就使用，是比較可惜的部分。但如果你只有拿著一台 S22 Ultra 的話，這就不是要擔心的了。']"
Samsung Galaxy S22 系列香港預購、早鳥禮資訊在這邊,https://chinese.engadget.com//samsung-galaxy-s22-series-hk-pre-order-072113117.html,2022-02-18,"['Engadget 編輯團隊致力為你蒐羅優質產品及優惠價格，文章內部份連結商戶與 Engadget 有合作關係，定價及供應量有機會更改，一切以商戶最新資料為凖。', 'Galaxy S22 Ultra 備有 256GB、512GB、1TB 三個版本，定價 HK$9,698、HK$10,798、HK$12,398，僅有 256 / 512GB 會有紅、綠、黑，以及 Samsung 獨賣的白色。1TB 版本更是 Samsung 網店獨家發售，僅有黑色配色。', 'Galaxy S22 會有 128 / 256GB 兩個版本，前者只有黑色，定價 HK$5,898；後者備有黑、白、粉金三色，定價 HK$6,298。稍大台的 Galaxy S22+ 就僅有 256GB 版本，定價 HK$7,998，有黑、白、綠三色。', '早鳥優惠方面，三款手機都是一樣的，在 2 月 18 日至 3 月 3 日的優惠期間，都會獲贈 Galaxy Buds Pro 耳機、矽膠薄型背蓋（附指環帶）和幸運盒指環帶，另外會有 4 個月 YouTube Premium 體驗、3 個月 Spotify Premium 體驗、6 個月 Microsoft OneDrive 100GB 雲端儲存服務，以及 Adobe Creative Apps 2 個月試用優惠。', '有需要的話，大家可以選擇多付 HK$998 加購 Samsung Care+ 2 年全面貼心保障，另外加購 Galaxy Watch4 系列智能手錶時會有 HK$800 折扣、加購 Galaxy Buds2 無線降噪耳機則有 HK$500 折扣。']"
Samsung Unpacked 直播這邊看，Galaxy S22 Ultra 正式登場,https://chinese.engadget.com//samsung-2022-unpacked-livestream-083556487.html,2022-02-09,"['Engadget 中文版以下為大家整理了官方發佈會的直播連結、動手玩文章，讓大家可以做好心裡準備。對了，大家在看完發佈會和文章之後先不要睡，因為我們 Engadget 中文版也會隨即開始直播，內容似乎還未定下來。大家如果有什麼想要知道的話，敬請在社交平台留言喔。', '']"
疑似 Galaxy S22 Ultra 新諜照流出,https://chinese.engadget.com//samsung-galaxy-s22-ultra-evleaks-leak-060629701.html,2021-12-31,['目前 Samsung 還沒有確認新機的發表時間，等正常來說應該是不會讓大家等太久啦。']
疑似 Galaxy S22 Ultra 新諜照顯示內藏的 S-Pen,https://chinese.engadget.com//samsung-galaxy-s22-ultra-photos-leak-035923355.html,2021-11-07,['不過和之前電腦圖不同的是，這次的機器背後每顆相機都變成了各自凸起，而非上次出現的一整個 P 形凸塊。但在規格方面新機的升級似乎不大，S22 Ultra 據稱仍會採用 108MP 主攝，同時有 12MP 超廣角以及 10MP 的 3X 和 5X 遠攝相機。按照爆料人 Jon Prosser 的說法，Samsung 會在 2022 年 2 月 18 日發售 Galaxy S22 系列，預售從 2 月 8 日便會啟動。']
諜照暗示 Galaxy S22 Ultra 會繼承 Note 的 S-Pen 筆槽,https://chinese.engadget.com//samsung-galaxy-s22-plus-ultra-design-leaks-060004818.html,2021-09-26,['至於 S22 和 S22+（也可能叫 S22 Pro），設計上似乎跟前代相比差別不大。內部據說會搭載新一代的 Snapdragon 或 Exynos 晶片，後置主攝相機也會換用 50MP 的感光器。目前還不確定新的 Galaxy S 旗艦會在什麼時候發表，如果 Samsung 延續去年做法的話，那可能在明年一月大家就會和它們見面了。']
