Title,Content,Comment,Date
Re: [問機] 板上很少人用剛出的HTC Desire 20 pro?,不只討論少用的人也少台中我想貼滿版的保貼 很多間都沒有也沒進這個的殼超冷門機種嗎※ 引述《furuta27 (追尋勇者的足跡)》之銘言: (一) 預算區間/已選擇之機種 (若為請版友選擇你考慮的機種，請填機種在這): HTC Desire 20 pro: (二) 使用需求 (例如:螢幕尺寸、拍照、高續航、高效能...等等): 偶而有玩遊戲 希望電量足夠: (三) 系統/品牌喜好 (例如:要XX品牌...不要XX品牌): HTC: (四) 補充說明 (補充說明以上沒提到的點): 以前用高階機跟轉換為中低階是否有差別?: 本魯使用一年多的U11+忽然打不開 報修說要換主機板: 如果只是換電池還好 要換主機板就不如換一隻新的: 剛好Desire 20 pro剛出沒多久 價格不高 電量看起來也多: 有大大分享使用過的心得嗎?: 先前一直很擔心這次換手機已經再也不買到htc了: 我的需求 遊戲偶爾玩 電量很重要 其他沒特別的需求: 以往都是用htc高階手機 沒用過中低階的 差距會很大嗎?,放棄不當年e8我只能網路找湊合著用的。吧。早被邊緣化的品牌當然沒店家進它的配件除非想賣不出。去。這個你在買之前不是早知道會遇到這種事了嗎。那麼多好用的手機 幹嘛非得買失敗品牌的產品。HTC都變成原生機了，居然還有人會買...。一個沒亮點沒人想用的牌子 SONY/LG/NOKIA 都比它好。網購看看阿。other呀。去買華強北的機器都比htc好。你第一次來嗎？這裡只用旗艦機和支那堆料機。頂多加個子龍或最近的pixel。昨天才剛入手XD。網購一堆。因為這裡大部分都很了解手機，不會去買XX。這版就用唉鳳 不然就窮人的大陸機阿。七進七出的華碩也沒有比這隻好。htc都把廠房跟研發團隊賣了，你還買他手機幹嘛？。ZF5到處都有配件可以買好嗎？HTC比ASUS更慘......。說真的他還有出手機才神奇…。我還想說U12+後就絕版了 沒想到還在寒風中擁抱==。網購找看看。規格不行啦，買來心酸的。萬能淘寶什麼都有,2020/10/17
[新聞] HTC Desire 20 Pro 推「晶耀綠」新色 即,"https://www.eprice.com.tw/mobile/talk/4542/5553617/1/HTC Desire 20 Pro 推「晶耀綠」新色 即日起上市HTC 在六月中的時候推出中階手機 HTC Desire 20 Pro，當初共有「墨晶黑」與「靚澈藍」兩種色系，而今日 HTC 也發佈新聞稿，將額外在台推出一款新色「晶耀綠」，即日起於 HTC 專賣店、HTC 網路商店以及全台中華電信、台灣大哥大、遠傳電信及台灣之星門市同步開賣，建議售價 8,990 元。另外，HTC 也針對振興券推出加碼活動，即日起至 9 月 30 日至 HTC 專賣店及專櫃門市購買 HTC Desire 20 pro 並同時適用振興券加碼活動，可享振興券 3,000 元兌換 3,600 元加碼優惠。HTC Desire 20 Pro 主要採用 6.5 吋 FHD+ 螢幕，內建高通 S665 處理器以及 6GB RAM、128GB ROM，手機搭載 5000 mAh 大容量電池，相機部分則使用 48MP 標準 + 8MP 超廣角 + 2MP 景深 + 2MP 微距的四鏡頭主相機，以及 2500 萬畫素前置相機等配置。","滿好看但我pass。我ok你先買。要也是買U20。SOC怎不用個730，765。什麼顏色還不都被保護殼擋住。背後指紋、正面挖孔的手機很氾濫，很像貼牌機。這個慘淡綠我可以，樓下先買。你這樣我們股歌四欸怎摸半 也是背面指紋正面挖孔XDD。665這價格ok嗎。上有realme x3 下有realme 6 可以洗洗睡了。這cpu很不ok。私訊他們小編死不說是用usf還是emmc。我OK你先買。推新色。665 8990 樓下先買。可能是eMMC。讚喔 8990。樓下買。eMMC5.1應該還好吧！玩遊戲的讀取要久一點喔。我很好奇板上到底有沒有人買過今年HTC的新機 XD。我啊 我幫阿母用HTC 當然是能刪的就刪 換個Launcher。反正我是不信HTC的後勤了啦._.。反而HTC還比三星更好搞定 三星挾帶太多垃圾了。x3真香。三星維修比htc乾脆一百倍。配色其實滿好看的。樓下買。豬屎出豬屎色。資費搭下來手機錢應該是沒多少了。我有加入早鳥。不過等著等著就買iphone了。EMMC...那我不如繼續用我的htc10。google了一下665比820還爛...HTC10屌打XDD。產品定位對手是鎖定三星A51吧。這麼有愛，2020買S665XDDDD。這個綠色我喜歡 但樓下先買我OK。這支不錯，一般手游玩起來大銀幕爽，電量有夠稱，買了黑。色給推。699資費中華，手機五千多。幾乎都買中階機，這支用了一個月沒問題，沒特定需求買最。高階不知道能幹嘛，拍照也可以。我端午節就幫我爸買了這支啊，用到現在沒什麼問題啦XD。大螢幕 大電量 拍照也比他原本HTC 10 pro成像佳。綜合來說不差，續航力頂尖，拍照堪用。S665日常使用也還。行。但通常能找到比HTC更高CP的硬體規格。軟體上，HTC的軟。體更新方面大概也是墊底的了吧....。這版就定位垃圾買垃圾唄。665 至少來個765g吧。超信仰。笑垃圾的真好奇都買什麼,手機又不是每個人都要最新最強或。者怎樣，品牌優缺各有好壞，難道你說小米歐普他們看起來c。p值最高，比他貴就垃圾嗎？我還沒說我朋友買三萬的sony哩。...XD。u20用765g啊... d20用730/710就很不錯 結果來個臭。不可聞的665==。跟中國機比價錢 那幾乎每支都比不過了。股價綠。挺好看的 但是我已經發過誓了。665就垃圾啊，sony也被罵過。手機的品牌力還是很有影響，在台灣拿htc多少還是比較有面子。還好吧  訂位長輩機 大家也都665 不用在酸吧。一堆通訊行賣7200誰還用三倍券折600？。下個月空機應該不用7000了 這次跳水有點慢。原諒機 感動上市。共匪機粉爽爽被偷個資吧。顏色感覺不錯 但就顏色。這隻續航大概是htc 10 三倍以上吧。醜爆 連配色也選不好。參見圖王。有些應該都固定酸，這支買來孝敬長輩覺得不錯。飛鼠大便的顏色，叫飛鼠大便綠更合適吧。台中有全新想轉讓說",2020/08/13
[問機] 板上很少人用剛出的HTC Desire 20 pro?,(一) 預算區間/已選擇之機種 (若為請版友選擇你考慮的機種，請填機種在這)HTC Desire 20 pro(二) 使用需求 (例如:螢幕尺寸、拍照、高續航、高效能...等等)偶而有玩遊戲 希望電量足夠(三) 系統/品牌喜好 (例如:要XX品牌...不要XX品牌)HTC(四) 補充說明 (補充說明以上沒提到的點)以前用高階機跟轉換為中低階是否有差別?  本魯使用一年多的U11+忽然打不開 報修說要換主機板  如果只是換電池還好 要換主機板就不如換一隻新的  剛好Desire 20 pro剛出沒多久 價格不高 電量看起來也多  有大大分享使用過的心得嗎?  先前一直很擔心這次換手機已經再也不買到htc了  我的需求 遊戲偶爾玩 電量很重要 其他沒特別的需求  以往都是用htc高階手機 沒用過中低階的 差距會很大嗎?,"這支還可以，不然就等u20或是買u12+。只能說堪用,同價格去陸韓品牌有更好的選擇...。tc在本版是救援被嘲笑用的！ 手法大概就是嘲笑安迪超譯為全。部tc粉都那樣！懂了沒。你真的鐵粉，佩服，一年多前用u11現在壞了，還想買新機。？我自己從desire z 蝴蝶1，2，到m7，u11，買超過十隻。，現在我跑Apple,心安理得！。剛購入u12﹢還ok。這是我第一次換不是TC的手機，它沒出855 865真的挺不下。去。6月份幫我爸買，用到現在沒什麼問題，系統很原生，沒有。阿雜多餘app預載在裡頭，電量強大，長輩使用習慣三天一充。沒問題，拍照也還堪用。指紋解鎖在手機休眠時可直接喚醒，配件的話，透明殼跟螢。幕保護貼在電腦家都買得到。上上禮拜剛幫我爸買過 應該沒什麼大問題…吧？。有玩遊戲上推u12+或等5G的u20。推U12+是在害人？。結果是要問機，請用格式。我用pixel的體驗htc好太多了，供你參考。真愛粉不離不棄。不離不棄，被當…。感恩。原來剛發表時那些支持的都是同一個人的分身呀，終於。知道為什麼tc會走到這田地了。雪紅。入手一隻還不錯。你有買她的股票嗎？認真問。剛出就買，有人首po就懶得分享了。算蠻輕的，螢幕也很順。眼，電量很有感。輕度使用，只用到line跟照相，使用上很。順暢，但相機只能說堪用。。這牌還在唷。這隻輕度用還可以啊！。同樣是s665；Nokia5.3有google one保證更新，只是螢幕HD。我看了很久 蝦皮上甚至還有六千出頭的。但我最後買nokia7.2。我今天去神腦看手機 才看到一個續約豬屎二零而已。我是你.不缺錢就上ZF6,一樣5000mAh,S855旗艦體驗不。降級。u11比u12穩。我買給我爸 他用的開心。htc exodus。不要浪費錢買垃圾。不喜歡也不要說別人是垃圾吧。沒人想當盤子。D20 pro還可以吧，續航力很猛，日常使用也很棒了。2手A8S 價格更便宜 CPU跟相機更好...軟體跟維修後勤更不用講。幾個月前幫長輩買一支保內的才6000 PWM還是0。現在的話我會考慮2手A71 因為5G的快上了 4G二手很多在拋。電子：：。2手機倫不到三星吧…。我U11還沒壞欸..只是電池續航不太好。我手上現在就A8s一年了，也是我第一次那TC以外的，電量。維持很不錯，cpu就普普中階機，拍照..就算了吧，軟體介。面我覺得一年了還是不太順手，銀幕我覺得比過去EYE 蝴。蝶一代 DHD 容易眼睛累，至於後勤我這四隻都沒面臨送修。所以無從比較。好吧 我敬重TC粉 但瞧不起HTC。我也用了五支htc沒用過它牌，在考慮U20說。。我HTC有兩隻送修前是好的 拆開就壞了 故跳槽。就安靜的陪著它走完 這句話看得出期待與無奈的感覺 推個。HTC永生不滅,本大不倒,像威盛一樣,變成僵屁企業。我有買 缺點是注音輸入法字選的很爛，重量太重，。優點就是照相不錯 電量夠。買給媽媽用，拍照，操作，續航她都很滿意，拍照有高。於我原本的預期！。d20 pro續航蠻厲害的，看你要不要也等u20。本來要等u20. 變成買iPhone se。中韓不買。sony太貴。華碩把台灣當二等市場。只能買iphone了。我買這隻給我爸，電量很夠，一般使用很夠了。看用865的精美售價，到時候還是會打價錢啊？什麼3萬買電子。xx。看了你的心得也難怪沒人用火腿腸吧 一萬多的手機才用一年。就打不開。我u11也很猶豫要不要換電池還是直接買其他的...從DHD到E8。到現在..。這隻適合跑外送用嗎？。手上有2015買的EYE，5年又3個月滑ptt還很順。想了解是否適合跑外送+1。我也是用了超過十年HTC跟快十隻，但真的u11+之後不。知道該換那款。稱了好久還是決定回到谷歌爸爸的懷抱。。u20+竟然連自家招牌edge aense跟雙立體聲喇叭都沒。有，還有什麼靈魂？",2020/08/02
[心得]簡陋開箱hTC Desire 20 pro,"昨晚下班收到,內容物,https://i.imgur.com/2W6t9de.jpg外盒側面標籤(抖了一下)https://i.imgur.com/hMO2ion.jpg比大小(左至右,Pixel2, Pixel3, Pixel3,Desire 20 PRO, Pixel3 XL,刪錯照片,多擺一隻P3備機,請忽略),https://i.imgur.com/fLIiIgM.jpg比P3XL長一點點窄一咪咪,系統幾乎原生,僅客制系統設定的軟體更新頁,預載APP多了 hTC Dr.eye Cloud,FM Radio, KKBOX, Quickstep,輸入法原生GBoard(我開機就選定系統用英文)正面沒有額頭下巴,左上角挖洞,實體摸起來的觸感,形容起來有點像放大版的S7摸起來的感覺,原生畫面操作起來很順暢,重度使用就不測了以上僅針對手機實物","沒用觸寶推一個。推開箱。推這支算相當不錯 保固怎樣不要想就好。推開箱。原來這麼大隻啊@@。現在還能看到上下有黑邊的手機實屬難得了，感謝分。享。沒額頭不過還是有一點下巴，不知道原型機是哪一隻。？。是說有845怎麼還會想用665，續約送的？。推開箱。螢幕超大又沒額頭，看起來很爽啊，也蠻適合長輩！。！。0元機應該滿可以的 不過我以為是MIT。好大一隻。螢幕真大。看起來蠻適合長輩機的，uu換這支算升級嗎？。算啊 光電量焦慮就減緩大半。恭喜中國品牌htㄈ回到祖國,慢走不送,不用回來了 中。國牌還賣貴。沒改用Bar而還是三鍵阿?。電量多1000的8T。根本不是MIT啊...搞笑，結果是MIC，中國在製造。推爆。希望有相機的開箱。台灣做的是765那隻好嗎。ODM 嗎@@?。等一個月後使用心得。挺ＭＩＴ挺到變ＭＩＣ 可憐啊。Desire沒有MIT過吧...。是lcd螢幕嗎？。本來就沒說這支是MIT阿。報導是說765那隻在台灣生產，但兩支外型機乎接近一。模一樣，看765背蓋還印MIT，挺故意的。一直在台灣生產的都只有比較高階的啊。推開箱！。啊啊啊啊 是 made in China 呀。請問有CA嗎？。6樓，可以隨便介紹個10隻上下無黑邊的台灣有賣的手。機給在下開開眼界嗎？ 為黑而黑真的很難看…。正面完全分辨不出來各手機的型號...。U20 5G才是MIT，黑黑回家洗洗睡。U20感覺不是真旗艦 而是中高階世代。hTC在這個所謂中高階世代之前的經驗不可說不慘痛..。總之還是希望印上MIT的不會是爛貨 我不敢買 你們先。但說真的U20 5G居然主打第一支MIT的5G手機真的讓人。想笑。一副擺明了除了MIT以外我沒什麼特點的感覺。樓上，我也覺得現在手機真的都沒什麼特點，只有硬體。有開箱 給推。固定升級而已，幾乎只有CPU相機螢幕更新而已。黑粉最愛嘴的不就是中國品牌嗎？ 把MIT當賣點也不行。根本都你的毛 反正你們也不會買啊。這台本來就沒說MIT=.=。通訊錄是原生的嗎?。這隻掉價後會不錯。台灣已經太久沒中低階機了665。不願意陸廠的可考慮。在網上打大概就是A70了。這種開箱有人權的100趴給與尊重。那些雲體驗也想護航的就算了。帥。說句實在話 不介意oled 要相同體驗直接買a31就好了。還更便宜 效能要好一點買a70 這台還是等降價吧。三星在更新這塊是贏HTC的。居然還有支持者QQ。desire 826及之前的機種確實是台灣做的。desire700用過還蠻耐摔的騎車噴掉都沒事，聲音也很。立體照相放大也不會模糊。只可惜最後開不了機換其他。牌了。真。中國品牌。怕。其實哪裡製根本不是重點，重點還是這支是不是ODM？。賣出一台ㄖ。所以這隻賣點是什麼？。台灣產線整條賣給Google了吧。以後應該也不會有貼MIT的手機了。宏達在西台灣上海廠早就收掉了。只要沒放Sense的核心功能Motion Launch 就保證是ODM。機了。屢試不爽。當初買蝴蝶機是台灣製的。MIC !!!。htc還有能力mit比較讓人驚訝。不過這種ODM還算小case，之前我爸買一台Desire 526。G+，連Sense都沒有，他覺得還好，但我用到快抓狂XD。MIC。再降一點會不錯。長輩機真的不錯。拍照如何呢？。勇者推。忽略保固價格產地規格品質外觀來說，確實是一支好手。機。推開箱。買Htc就跟買納智捷一樣 要很有愛。desire mit啊 大概816有。好香  吸起來。htc旗艦全是MIT，中低階就不一定。help the company。恭喜。推。好久不見的HTC，先推再說。有些人講的其他牌不是大陸製一樣。所以蘋果大陸製 大陸賺比較多？。desire 20 pro 有3.5耳機孔喔？。有3.5mm耳機孔。這版從來都不缺htc黑，很多都還沒有邏輯的亂黑一通。，雖然我也常常噴tc啦…。這台有通話錄音嗎。為何不給845/855？。幾乎是原生的Android 10,沒有電話錄音。感激原po解答。真君子。這版已經子龍大於火腿腸了 就覺得很好笑 但我只想。看看u20會不會到最後又推不出來。看來沒有hTC Sense...。目前U11+ 加上gcam 相機很滿意 到底換哪支相機可以。有感升級阿。我的煩惱跟你一樣www。made in China。中國品牌最ㄅㄧㄤˋ。唉 還是近乎原生系統 嘖嘖。6樓哈哈哈哈哈哈哈。哇 d20p 屏佔好高啊！。與正妹如果有買，那就值得買。金與正要買也會買旗艦啦。中國製 與正會買嗎？。是eMMC嗎。推。吃過大虧才懂為什麼這麼多人黑H。這隻我剛買給我媽換機 大電量大螢幕6G/128配665。真的是最佳長輩機 我媽第一個看螢幕夠不夠大 第二個。問電力能撐多久 只要滑起來順 剩下就挑外殼顏色=_=。感謝分享",2020/06/20
[新聞] HTC Desire 20 Pro設計圖出爐：打孔屏，,HTC Desire 20 Pro設計圖出爐：打孔屏，極窄邊框https://www.ithome.com/0/485/345.htm—IT之家5月1日消息 爆料大神@evleaks 分享了一張HTC Desire 20 Pro的設計圖，圖片顯示，該機將成為HTC首款搭載打孔屏的手機。http://img.ithome.com/newsuploadfiles/2020/5/20200501112018_6660.jpg設計圖顯示，HTC Desire 20 Pro採用了平面顯示屏，並且手機的邊框非常窄，側面和頂部/底部的邊框是一樣寬的。HTC Desire 20 Pro背面搭載四攝像頭，底部最小的鏡頭很可能是深度傳感器，該機還後置指紋識別器。還有一位洩密者稱HTC Desire 20 Pro將有一個3.5mm耳機插孔，在上面的設計圖上無法看到。IT之家瞭解到，Geekbench顯示HTC Desire 20 Pro搭載驍龍660（或665）處理器，6GB內存，運行Android 10。—背面設計真的很醜 2020了還在後置指紋根660 哇 這什麼垃圾設計除了正面感覺有看頭之外 我不知道這隻還有什麼優點我想不到不買紅米note 9而要買這隻的理由,GSMarena iPhone SE (2020) review。不信邊框這麼細。賣6990再叫我 不過不可能。我要支持HTC。我也想不到為什麼要買小米這種中國手機。賣一萬五，消費愛國情懷可以。希望HTC出有實體鍵的...。ODM貼牌手機。實體指紋還是比較快啊！。看起來今年又沒旗艦了。哈哈哈哈htc終於用660了，可喜可賀。支持htc，支持台灣貨。電量&價格比較重要 不過是HTC 那完全不用期待。邊框四周等寬 不可能吧。我還以為我看到了紅米。背面設計垃圾？不是每家都這樣、還是方形才是屌？。給我旗艦，其餘免談。終於要出這麼窄邊了?。S660？？？我開始懷疑今年是不是2020年了。前面醜爆 背面有指紋給推,2020/05/02
[情報] HTC Desire 20 pro 資訊,twitter上 LlabTooFeR爆料HTC新機Desire 20 pro高通S665處理器 6G Ram正面設計=OnePlus 8 (這屏占比有可能嗎TC?)背面設計=小米10有3.5m耳機孔http://i.imgur.com/yTN7Vs4.jpg附上跑分流出https://browser.geekbench.com/v5/cpu/1866897,sense ui還在嗎? 還是又是假原生?。售價決定一切。pro在哪？。看多少錢吧 萬元內會想入手。所以我說那個旗艦機呢？。一整年沒出，855系列旗艦機型直接搞空白，可憐哪。HTC SE。htc做春夢唄。搶不到貨了吧。HTC想東山再起 就得自己開發CPU。價錢決定一切。不要在推中階電子垃圾了拜託，旗艦機已經消失快兩。年了@@。我猜8990，N個月後出款當時的8990。再啦幹。電子垃圾。用S665叫Pro？用S765還差不多。連自己該出什麼都搞不清楚，大概沒救了。最多就8990。不如U11重製優化 15000內我就買。pro的點在哪?。htc只能找聞泰、龍旗、華勤之類的做，那可能有s855。s665不是很弱嗎，htc這樣怎麼跟人打。沒S865又沒S765好歹來個S730。和紅米note 8t同一個廠出來的？。遺傳到3000mah小電池的話pass。電子拉基。這公司還沒倒喔？。賣6000一下考慮。這公司的產品誰買誰倒楣。665哈哈哈哈哈哈。哈哈哈哈哈哈哈哈哈哈哈哈哈哈哈哈哈哈哈哈哈哈哈。哈哈哈哈哈哈哈哈哈哈哈哈哈哈哈哈哈哈哈哈哈哈哈。這規格  應該會賣個14990。難以置信Htc還存活。HTC到底還要玩爛Desire這型號名稱多久……。至少是desire用這顆U，之前6系列的可是放在U12lif。e。這機名再玩下去真的要變豬屎(台語)了XDD。價錢很pro。665 要賣破萬嗎。比較好奇今年為止ASUS沒新機任何消息。絕不考慮豬屎系列，保固內就放生。把s600系列放在desire上不錯了啦！。上一支已經是多年前的d826了。剩下價錢，請7000內。5000元我就買。可憐那。6開頭現在算低階了吧 7開頭才能說中階了。比紅米8T貴就註定沒有市場，台灣人比完規格直接看。同規格價格，電信業代們都說對tc 沒信心…。然後賣24900。竟然有先進的3.5mm。價格=iPhone 11 Pro。期待高螢幕比!,2020/04/25
