Post Title,Link,Content,Date
[問題] ROG phone 5s 特規版能裝5合一基座嗎,https://www.ptt.cc/bbs/MobileComm/M.1649080726.A.E78.html,Content：乳題在pc home 只看到支援1-3代請問5也能裝嗎？不能裝的話，有啥替代方案嗎手機當pc用  也是吸引我的地方如果不行就麻煩了...我已購入了....; Comment：http//i.imgur.com/MSIq8EU.jpg。不能沿用會被噴到翻掉吧。不能沿用之前的雙螢幕和桌上型基座實在可惜。雙螢幕那幾個配件不能沿用讓我對這個系列沒什麼興趣了。退貨啊 又不是不能退,2022/04/04
[心得] rog phone 5s 特規版 簡易開箱,https://www.ptt.cc/bbs/MobileComm/M.1643098248.A.431.html,"Content：https://imgur.com/GQT7GvA.jpghttps://imgur.com/rFzgMOn.jpg領到年終後 直接買了rog過年前換台新機好過年舊機也用了3年多了 該退休了當初有好幾個品牌在選後來選rog 還是因為他遊戲功能最全面打遊戲手感確實比其他品牌好太多有去專賣店試玩幾次後 現場刷下去(還好今年年終不算少意外發現喇叭音量很驚人...airtriggers用起來很爽特規版的價格比以前定價 便宜蠻多的少了風扇但是登錄會多送遊戲手把XD總之才拿到手不久 好像沒什麼太多心得現在疫情又開始變嚴重 過年剛好讓我可以宅在家整天都打手遊 打到膩XDDD; Comment：自己買過rog3 ,華碩死機真的很厲害。連ROG3也死雞？。推開箱，如果圖多一點就好了。之前不出低規版,怎麼感覺是中國賣不完,刷版本拉來出清。我的ROG一代現在還。在車底。請期待保固內的死雞。應該問哪代沒死雞過。這隻會死機嗎。以前手機跑不動的那些遊戲，換ROG後都可以順順玩了。https//bit.ly/3tYIgLc。其實rog手機真的不錯，但品質就是不好好把關。沒有它的風扇到還好，可以物色一下黑鯊的製冷風扇，。效果更好，只是麻煩在要另外插電。這支我用到現在體驗真的是屌打蘋果價格也是。3代保內死機，原廠受潮不受理，手機行卻說看起來根本。沒有受潮，但是還是修不好。https//i.imgur.com/hyN88hb.jpg。這是我的三代 還好二代備用還沒賣。以後不敢買子龍ㄌ。沒超過3萬，也太值得買了吧～airtriggers打moba類遊戲。手感超好。rog5打遊戲超爽der~不玩遊戲一般日常使用也超可以，同。價位中他的規格最頂",2022/01/25
[購機] ROG Phone 5s Pro與Samsung S21 Ultra,https://www.ptt.cc/bbs/MobileComm/M.1639213117.A.F00.html,"Content：1.預算範圍/考慮機種：ROG Phone 5s Pro 與 Samsung S21 Ultra 256GB這兩支通訊行大概都在3萬以下2.使用需求因為使用超過4年半的U11終於掛點了，應該是主機板與CPU掛了。想找一支可以用超過4年的旗艦機種，續航長一點好。3.品牌喜好(不要XX品牌，要OO品牌)：沒有特別反感的品牌4.補充說明：S888與S888+雖然都是今年旗艦機中用的CPU，但效能耗電發熱都惡評如潮。如果用S21是否會有常常散熱不良的問題，而且電池比ROG略小。但ASUS的手機容易過保就壞，而且UI以及系統更新都遠不如三星。三星贏的應該是拍照與螢幕，而ROG是效能散熱。還是要等到明年用8 Gen1啊?──────────────────────────────────────; Comment：我U11也開始漏電了  M9 噴火龍810還活跳跳。選最貴的。不如買1萬5  兩年換一次機。哀鳳或s870中國機。這兩個秒選S21U，除非對ROG有愛，不然還是乖乖選三。星相對安全。三星哪裡安全？。相對安全。等新機...。888能閃則閃 就是X。能等就等，雖然說明年我也不看好就是了。三星至少不會死機。ROG 5 目前用起來沒什麼問題，散熱也還行。續航長選ROG吧，S21U續航不好。我比較怕出事，我買ROG5+2年保險。需求要用4年，選ROG？呼叫現在ROG一代的使用者出來。分享一下。。一代摔到不能算數，二代使用者現身說法，用了一年又。11個月後無預警死機再也開不了機，好在當時已經是備。用機資料都轉移完成了。三星的售後參考一下上下文。這麼多篇死機還能考慮ROG，呵。三星怕螢幕死給你看 至少我S21快一年惹還沒遇到...。單就這兩支比，選S21U。選S865的，S888太火龍了。真的需要ROG的遊戲功能再選他，不然選S21U。或看你啦，也有人是因為手機外觀（？。都不要 S888就是毒瘤。前5z使用者，輕度使用就過熱shut down ，修主板要1。w5給你參考。本板應該沒人會推三星吧 你說呢。一個會死 一個會燒  不考慮一下其他的?。笑死  iPhone也會啦。三萬去買iphone...。等發哥。我覺得這時間你可以蹲明年的新機了。三星還是穩喔。韓國子龍vs 台灣子龍。用超過4年 過程中會換電池嗎？ 不會的話找不到。pixel 6 pro?今年及明年android旗艦cpu發熱耗電明。顯，選去年旗艦機吧...。還在用U11滑這篇，以更新承諾我會考慮pixel或三星。也是4年半的U11掛了，我是買U20墊一下看明年手機。不是重度手遊用s21u，拿了一陣子沒毛病。ROG5真的好用，也沒遇到發燙問題。我手上的512GB版ROG1代自2018年9月購入保固1年半，在202。0年3月過保前1個月出現正切螢幕的壞痕，趕在保固內順利。安排當日維修+換新電池。。第二任螢幕大概用了半年以上到2020年10月在上下系統列出。現些微烙印。使用上不影響但影響心情。在2021年5月尾插。故障後送皇家，1周後取回。。這台ROG1的機生不能說一帆風順，但時至今日2021年12月，。依然是作為我的日常手機使用，系統上沒出現過死機問題。應該算我運氣好。。s21 u 很少有3萬以下吧....。我的U11兩年前就漏電了，一個晚上待機可以噴掉一顆電。池。ROG5。p.s我的ROG 1目前我爸繼續用沒問題，我自己是又買ROG 5。46樓大大出來救援。你跟我很像 我前一隻用u11+ 現任是rog2 現在也在看這兩隻。rog5spro目前還很好買 s21ultra頂規不好買。只是最近做功課發現這兩隻都會莫名出包：死機、網路不穩。、綠（黑屏）等等。讓我不知如何選擇囧。我17年7月的u11,到現在沒換過電池，電量沒退太多，看來我。的使用方式，下台不需要太考慮電池的問題，只要糾結側框。按鍵的問題.....",2021/12/11
[新聞] 地表最強電競手機:ASUS ROG Phone 5s發表,https://www.ptt.cc/bbs/MobileComm/M.1629104588.A.706.html,"Content：1.原文連結：https://pindoo.tw/news/mobile/6002/2.原文標題：地表最強電競手機：ASUS ROG Phone 5s 發表3.原文來源(媒體/作者)：Pindoo 拼讀 / inno4.原文內容：請刊登完整全文(否則依板規刪除並水桶)。如同先前傳出的消息，華碩 ASUS 了【ROG Phone 5s 】玩家共和國系列電競手機，且確定搭載高通最強的 Snapdragon 888+ 處理器，成為現今台灣市場最強效能的一款Android 手機產品。ASUS ROG Phone 5s 系列這次共推出了 ROG Phone 5s 與 ROGPhone 5s Pro 兩款產品，並且最高搭載 18GB 的 RAM 記憶體，完全在規格方面讓電競玩家將沒有後顧之憂。採用全新高通 Snapdragon 888+ 處理器ASUS ROG Phone 5s 將採用高通最新的 Snapdragon 888+ 處理器，這款處理器先前在MWC 大會上現身，同樣採用了三星 5nm 架構製程推出，時脈由原先的 2.84Ghz 提升至3.0Ghz，雖然在時脈部分指提升了 10%，但是華碩表示在 ASUS ROG Phone 5s 系列手機上將會提升 25% 的效能；同樣在安兔兔的跑分成機上 ASUS ROG Phone 5s 系列可以跑出 864518 分的成績，並且延續了上一款 ASUS ROG Phone 5 的中置 CPU 以及 3D 均溫散熱版的設計，加上外接主動式風扇的搭配將可全面將高通 Snapdragon 888+ 處理器發揮到極致。在記憶體方面，ROG Phone 5s 與 ROG Phone 5s Pro 均採用 LPDDR5 的記憶體以及UFS3.1 規格的儲存空間，ROG Phone 5s 在設計上採用 RPG 燈光 Logo 功能的機背顯示以及 16G/256G 和 18G/512G 規格版本；而 ROG Phone 5s Pro 則是採用了全彩 PMOLED幻視螢幕與最高的 18G/512G 的記憶體容量空間，而背後的全彩螢幕則可以自訂六種顯示動畫。螢幕觸控採樣再提升至 360Hz喜愛遊玩電競遊戲的玩家們一定比起螢幕更新率更會介意螢幕的觸控採樣率吧！ASUSROG Phone 5s 系列同樣使用了 6.78 吋 20.4：9 的 2448×1080 (395ppi) 解析度螢幕，並支援 144Hz/1ms AMOLED HDR10+ 等頂級規格，不過在螢幕採樣率的部分則是從300Hz 提升至 360Hz，螢幕反應時間上更提升至 24ms，在螢幕的觸控反應時間上則是有更靈敏的反應，另外在螢幕同時支援的部分同樣 Always-on HDR、Delta E<1 的顯色等級的規格。6000mAh 容量大電池、65W 規格高速充電ASUS ROG Phone 5s 同樣採用雙 3000mAh 容量的並聯式電池，並支援了 65W 的快速充電功能，讓  ASUS ROG Phone 5s 只需要花 30 分鐘的時間就能充飽超過七成的電池容量、51 分鐘就能完成整部手機的充電。同時隨手機盒裝也會附上 USB-C 65W 高速充電器，玩家們也不用特地還要多買充電器來使用即可馬上享有 65W 高速充電的功能。AirTrigger 5 功能再進化而考慮到電競玩家的使用需求，ROG Phone 5s Pro 還特地加強了 AirTrigger 的控制功能，將提供四種感應模式、18 種手勢操控置方式，另外全新升級的單側超音波觸控鍵將可同時支援兩種手勢 : 點擊+長滑或撥滑。另外在體感模式下也支援了 10 種的不同的軸向操控設計，除了原先的 X/Y 軸面的轉向之外，這次更增加了 Z 軸的轉向功能，玩家如果在遊玩賽車類型遊戲時將可以獲得更加細膩的操控。另外在 ROG Phone 5s Pro 的功能上，還多設計了兩款觸控區域，可以透過觸控點擊的方式多出兩組按鍵操控，對於電競玩家來說將會是更多的控制選擇。延續 6400 萬畫素三鏡頭主相機在 ASUS ROG Phone 5s 系列上，則是沿用了 6400 萬畫素鏡頭的主相機，同樣使用了Sony IMX 686 感光元件、0.8 μm 的像素密度、f/1.8 光圈、支援四合一像素合併的的功能可拍攝更純淨的 1600 萬畫素照片；超廣角像機的部分則是搭載了 1300 萬畫素、125 度的拍攝功能；最後提供一組 500 萬畫素的 f/2.0 的鏡頭，將應用在微距功能的拍攝上。配件延續再使用 換機配件免升級最後在配件的部分，則是可以繼續沿用 ROG Phone 5 的專屬配件，除了基本的保護殼以及動力風扇皆可延續使用之外，專屬遊戲控制器、五合一擴充底座以及控制器遊戲支架皆可無痛直上，過去買的配件不用擔心因換機而變成孤兒。台灣上市價 29,990 元起 買就送遊戲控制器 3ROG Phone 5s 系列於今（15）日起至 8 月底於全台華碩專賣店、 ASUS Store 與各大電商平台開放預購，在價格的部分 ROG Phone 5s 的建議售價為台幣 29,990 元，至於要升級到 18GB＋512GB 款的話則是要再加上 4,000 元，來到台幣 33,990 元，同時兩者皆有 幻影黑/極光白 兩 色；至於最頂尖規格的 ROG Phone 5s Pro 18GB/512GB 版本則是台幣 37,990 元，顏色 部分只有 幻影黑 配色。凡於 9 月底前於全通路預購或購買 ROG Phone 5s 系列任一中種，即贈 ROG Phone 5s系列遊戲控制器 3（價值 NT$3,990），贈品數量有限，送完為止。5.心得/評論：內容須超過繁體中文30字(不含標點符號)。台灣終於有一款確定會在台上市的高通 S888+ 機種了沒有意外應該就是ASUS ROG Phone 5s 搶下頭香這次等於是升級了原本 Ultimate 的機背螢幕單色改為雙色，還多了一組觸控按鍵(究竟多少打電競的玩家會用到這麼多按鍵?)接下來就是確定正是售價的部分了; Comment：ROG Phone 5 用戶：。想爽玩的上班族 就這樣。ROG Phone 5s售價16GB＋256GB為2萬9990元。18GB＋512GB為3萬3990元。微改款。ROG Phone 5s Pro售價18GB＋512GB為3萬7990元。蘋果公布的售價。pro終於出來了。5U才出沒多久就過氣了，而且還比較貴。外接風扇,看來是原神專用機。ROG2的更新呢？。最強子龍機 還是要出任務。沒附隔空揮刀 失敗。有附刀嗎?。話說不升成6是因為還是888嗎。上一個自稱地表最強的...XD。3萬我會買apple...。果然5U後面黑白是錯誤設計，當初PRO設在中間就很怪。現在可以合理把PRO後面彩色螢幕+1000變成5S賣。888銷庫存，熱到空焊。真的是黑白變彩色。欸不是 5不是才剛出。5出快半年了吧。嗯上次這種新聞一代沒多久就通知不能更新（放生）。了...推測ROG2接下來也要通知停止更新惹QQ。當初5-PRO(彩色)-UL(黑白)很明顯就是設定錯誤。這不就是把5 pro升級成5s pro。現在重新定調 把PRO變成新旗艦，就完全合理了。不過不知道有沒有大禮包，不然全面升級只比UL多1000。這樣買UL的會不平衡吧。5s和5的價格...？。5U光速過氣。覺得華碩出這種手機真的很敢，是利潤很好還是中國銷。量很好，這我沒看過有人拿過，都這麼多代了。就原神專用機啊,除了原神哪款手遊吃硬體那麼兇。賣信仰的 想當真子龍的可以考慮。適合流汗肥宅。電熱刀。中國機圈：""主打""客戶的品牌？。https//bit.ly/2XngGsI。華碩這種垃圾跟地表最強是不會有交集的。樓上你錯了，華碩是地表最強的刀啊。專門打遊戲選Apple?螢幕電池散熱充電都降級欸。買的人真心佛。所以rog 5 pro到底有沒有要出啦。看看那精美相機規格，真的是夠盤。地表最強 明年過氣。5U才出貨沒多久光速過氣。5U真的超瞎。買Ultimate直接過氣  背面螢幕黑白的哈哈哈。最強的電子垃圾 大家快上。普通。最強的任務之永無止境。。買高階安卓就是韭菜 笑死。地表最強升級放鳥品牌。小編的刀不止架高層脖子，順便割韭菜。就中國堆料機啊。幫買5U的QQ。地表堪稱史詩般最強電競子龍任務手機！。七進七出之永無止境七部曲。。刀子。嘔嘔嘔嘔嘔支那機。挖草 18G Ram。A15表示。真的是把預購5 Ultimate的當北七....... 只好含淚再。買一支 5U給家人用了。地表最強那A13 VS 888+ 有贏嗎？ 另外兩萬以上選i。Phone 結案。放生機？。這規格...我想不到不買一萬二黑鯊買三萬子龍機的理。由。相機也被刀  怎麼不用 標準組合?。然後超廣不升級自由曲面 586 ?。貴又容易壞，然後又修不好吧？。iphone就雙層主板，直接給你過熱卡死，動點腦可以嗎。？跟ROG沒得比的。哀鳳超容易過熱的 連視訊都會熱當 電子垃圾嗎",2021/08/16
[新聞] 華碩 ROG Phone 5s 規格曝光！最快八月,https://www.ptt.cc/bbs/MobileComm/M.1628682274.A.30C.html,Content：1.原文連結： https://3c.ltn.com.tw/news/454972.原文標題： 華碩 ROG Phone 5s 規格曝光！最快八月底有望公布3.原文來源(媒體/作者)： 自由時報 3C科技頻道／綜合報導4.原文內容：華碩 ROG Phone 5s 規格曝光！最快八月底有望公布2021/08/11 08:153C科技頻道／綜合報導https://img.ltn.com.tw/Upload/3c/page/2021/08/10/210810-45497-1.png（圖片來源／玩家共和國）先前曾有消息透露華碩（ASUS）將會針對自家高階遊戲手機「ROG Phone 5」推出強化版本，而稍早據外媒《Wccftech》消息，這款手機有望被稱作「ROG Phone 5s」，同時也一併流出了相關規格。據報導，華碩新款 ROG Phone 5s 將會延續 ROG Phone 5 的外觀設計，但硬體規格將會獲得升級，例如處理器會改為高通 Snapdragon 888 Plus，記憶體容量也將擴增成 16GB、18GB LPDDR5，並會推出 256GB、512GB 兩種儲存容量的機型。https://img.ltn.com.tw/Upload/3c/page/2021/08/10/210810-45497-2.jpg（圖片來源／擷取自 @bhuvnesh_bagri 推特）整體來說，ROG Phone 5s 有望會有目前最豪華的智慧型手機硬體規格，但據《Wccftech》的說法，高通 Snapdragon 888 與 Snapdragon 888 Plus 在跑分上不會有太大的差別，只是華碩可能會在 ROG Phone 5s 使用更好的散熱系統來提升處理器的表現。外傳 ROG Phone 5s螢幕將會升級成 144Hz OLED 顯示器，但尺寸可能不會變，另外該機還將搭載 6000mAh 電池，並支援 65W 快速充電，在遊戲體驗上可能會有更好的表現。《Wccftech》指出，華碩很有可能會在今年（2021）8 月 16 日公布新機，以取代舊機型，且價格將會維持不變。5.心得/評論： 看來下半年安卓這邊就是888+撐場了!  擺明是衝著pixel 6來的              這規格這價格我看是稱霸了; Comment：pro表示：？？。！！！。中國網友都在笑遊戲手機cpu虛焊，哪代能解決？。有沒有ROG Phone SE啊XDDDD。光是核心屌打就不用理什麼白教堂了啦，那個手機長。那樣有夠醜，別跟我說能更新幾代優化多好。我們的優化肯定更好更久啦，笑死。根本不是同一個level。感覺就是 5 Pro 換處理器推出。畢竟5 Pro原本預計背面搭載彩色螢幕  賣比Ultimate。便宜早就被嘴爛。不如換成888+ 記憶體升18G. 就有理由賣比Ultimate。貴了。你說是吧~ iPhone SE。有人要生氣惹 因為他覺得華碩出旗艦的速度太快。那個人自刪了啦 嘻嘻。rog也可以機海嗎！？是說5 pro哩？。原本不就是144Hz oled??。不就把之前彩色版那隻換心重推出而已嗎。要不要學顯卡來個5ti。ROG 5/5s/5Ultimate/5Pro?未來有5i/5R/5C嗎XDDDD。5 PRO 到底出了沒。5Ti/5Turbo/5Super/5Xtreme/5mini。ROG Phone玩機海  華碩真的是不怕沒錢燒欸。5goBagLena。可憐 還好跳三星了。刀粉最愛，一次買一打。5 S SE XLE PRO MAX PLUS。所以我說那個炫光殼呢？。ROG Phone 5DX+。我加速丟丟丟。這個心得怎麼好像反串 XD，既然有PLUS版的888為什麼。急著在年初就推出ROG了，以後都半年就換代了嗎？。為什麼不用870反而用888+…。早出價格好...還可以大家幫忙debug...因為我ROG2一。開始使用問題比ROG5少。原來之前年初買的是半成品啊。https//i.imgur.com/i0zwBt3.jpg。真的需要更好的散熱。ROG3表示：。傻眼5才出來多久。電子孤兒。記得5出來有人就爆料那散熱系統根本亂搞。手機散熱佈局沒啥問題，是風扇有問題，換成制冷片。的散熱器就搞定的事情偏偏用那沒屁用的風扇……。同樣都是搭配用製冷片的風扇，Rog5實測是最強的。ROG電子孤兒又要＋1。小改款 還敢拿出來賣。5的散熱跟前幾代比就真的滿屎的啊。前幾代風扇帶走散熱片熱量。這代背面是一整塊完整玻璃散個屁熱，風扇那個設計。又把空氣力學當屎。18g ram 比我電腦還多==。我手機12g ram 電腦才8g ram。電腦爛可以不用那麼大聲。設計師是跑路了嗎？性能什麼先不說，外觀一代比一代。醜是怎樣==？。5代炫光保護殼到底要不要出了啊,2021/08/11
